[
  {
    "trial_id": "mc_audit_log__oracle__rep1",
    "task_id": "mc_audit_log",
    "family": "memory_critical",
    "suite": "capability",
    "condition": "oracle",
    "replicate": 1,
    "model": "sonnet",
    "effort": "medium",
    "judge_model": null,
    "started_at": "2026-06-23T18:06:58.556414+00:00",
    "finished_at": "2026-06-23T18:08:08.489534+00:00",
    "duration_seconds": 69.93300318717957,
    "solved": true,
    "completeness": 1.0,
    "no_regression": true,
    "static_clean": true,
    "completed_within_limits": true,
    "scores": {
      "outcome_pass": true,
      "regression_pass": true,
      "static_pass": true,
      "completeness": 1.0,
      "rubric_score": 0.0
    },
    "manipulation_check": {
      "injected_context_chars": 795,
      "seeded_memory_count": 3,
      "recall_calls": 0,
      "memory_fired": true,
      "notes": []
    },
    "metrics": {
      "assistant_message_count": 15,
      "tool_use_count": 9,
      "mcp_calls": 0,
      "recall_calls": 0,
      "tool_error_count": 0,
      "completed": true,
      "result_subtype": "success",
      "num_turns": 10,
      "total_cost_usd": 0.20763009999999998,
      "duration_ms": 64360,
      "token_input": 10,
      "token_output": 3166,
      "token_cache_read": 220647,
      "token_cache_creation": 15502,
      "files_changed": 8,
      "diff_lines_added": 36,
      "diff_lines_deleted": 0,
      "claude_exit_code": 0,
      "injected_context_chars": 795,
      "seeded_memory_count": 3
    },
    "paths": {
      "workspace": "<repo>/evals/runs_p/mc_audit_log/mc_audit_log__oracle__rep1/workspace",
      "stdout": "<repo>/evals/runs_p/mc_audit_log/mc_audit_log__oracle__rep1/claude.stdout.log",
      "stream_json": "<repo>/evals/runs_p/mc_audit_log/mc_audit_log__oracle__rep1/claude.stream.jsonl",
      "git_diff": "<repo>/evals/runs_p/mc_audit_log/mc_audit_log__oracle__rep1/git.diff.patch",
      "grader_log": "<repo>/evals/runs_p/mc_audit_log/mc_audit_log__oracle__rep1/grader.log.json",
      "injected_context": "<repo>/evals/runs_p/mc_audit_log/mc_audit_log__oracle__rep1/injected_context.md"
    }
  },
  {
    "trial_id": "mc_audit_log__mcp_only__rep2",
    "task_id": "mc_audit_log",
    "family": "memory_critical",
    "suite": "capability",
    "condition": "mcp_only",
    "replicate": 2,
    "model": "sonnet",
    "effort": "medium",
    "judge_model": null,
    "started_at": "2026-06-23T17:54:12.077609+00:00",
    "finished_at": "2026-06-23T17:55:21.970193+00:00",
    "duration_seconds": 69.89259815216064,
    "solved": false,
    "completeness": 0.8,
    "no_regression": true,
    "static_clean": true,
    "completed_within_limits": true,
    "scores": {
      "outcome_pass": false,
      "regression_pass": true,
      "static_pass": true,
      "completeness": 0.8,
      "rubric_score": 0.0
    },
    "manipulation_check": {
      "injected_context_chars": 0,
      "seeded_memory_count": 3,
      "recall_calls": 0,
      "memory_fired": false,
      "notes": [
        "recall is agent-initiated; see recall_calls metric"
      ]
    },
    "metrics": {
      "assistant_message_count": 28,
      "tool_use_count": 21,
      "mcp_calls": 0,
      "recall_calls": 0,
      "tool_error_count": 0,
      "completed": true,
      "result_subtype": "success",
      "num_turns": 7,
      "total_cost_usd": 0.17598170000000002,
      "duration_ms": 67770,
      "token_input": 10,
      "token_output": 1544,
      "token_cache_read": 151056,
      "token_cache_creation": 12078,
      "files_changed": 8,
      "diff_lines_added": 26,
      "diff_lines_deleted": 0,
      "claude_exit_code": 0,
      "injected_context_chars": 0,
      "seeded_memory_count": 3
    },
    "paths": {
      "workspace": "<repo>/evals/runs_p/mc_audit_log/mc_audit_log__mcp_only__rep2/workspace",
      "stdout": "<repo>/evals/runs_p/mc_audit_log/mc_audit_log__mcp_only__rep2/claude.stdout.log",
      "stream_json": "<repo>/evals/runs_p/mc_audit_log/mc_audit_log__mcp_only__rep2/claude.stream.jsonl",
      "git_diff": "<repo>/evals/runs_p/mc_audit_log/mc_audit_log__mcp_only__rep2/git.diff.patch",
      "grader_log": "<repo>/evals/runs_p/mc_audit_log/mc_audit_log__mcp_only__rep2/grader.log.json",
      "injected_context": "<repo>/evals/runs_p/mc_audit_log/mc_audit_log__mcp_only__rep2/injected_context.md"
    }
  },
  {
    "trial_id": "mc_audit_log__baseline__rep1",
    "task_id": "mc_audit_log",
    "family": "memory_critical",
    "suite": "capability",
    "condition": "baseline",
    "replicate": 1,
    "model": "sonnet",
    "effort": "medium",
    "judge_model": null,
    "started_at": "2026-06-23T17:44:02.982436+00:00",
    "finished_at": "2026-06-23T17:46:04.761723+00:00",
    "duration_seconds": 121.77920293807983,
    "solved": false,
    "completeness": 0.8,
    "no_regression": true,
    "static_clean": true,
    "completed_within_limits": true,
    "scores": {
      "outcome_pass": false,
      "regression_pass": true,
      "static_pass": true,
      "completeness": 0.8,
      "rubric_score": 0.0
    },
    "manipulation_check": {
      "injected_context_chars": 0,
      "seeded_memory_count": 0,
      "recall_calls": 0,
      "memory_fired": null,
      "notes": []
    },
    "metrics": {
      "assistant_message_count": 32,
      "tool_use_count": 22,
      "mcp_calls": 0,
      "recall_calls": 0,
      "tool_error_count": 1,
      "completed": true,
      "result_subtype": "success",
      "num_turns": 12,
      "total_cost_usd": 0.2812661000000001,
      "duration_ms": 118434,
      "token_input": 14,
      "token_output": 3551,
      "token_cache_read": 286523,
      "token_cache_creation": 16655,
      "files_changed": 10,
      "diff_lines_added": 56,
      "diff_lines_deleted": 0,
      "claude_exit_code": 0,
      "injected_context_chars": 0,
      "seeded_memory_count": 0
    },
    "paths": {
      "workspace": "<repo>/evals/runs_p/mc_audit_log/mc_audit_log__baseline__rep1/workspace",
      "stdout": "<repo>/evals/runs_p/mc_audit_log/mc_audit_log__baseline__rep1/claude.stdout.log",
      "stream_json": "<repo>/evals/runs_p/mc_audit_log/mc_audit_log__baseline__rep1/claude.stream.jsonl",
      "git_diff": "<repo>/evals/runs_p/mc_audit_log/mc_audit_log__baseline__rep1/git.diff.patch",
      "grader_log": "<repo>/evals/runs_p/mc_audit_log/mc_audit_log__baseline__rep1/grader.log.json",
      "injected_context": "<repo>/evals/runs_p/mc_audit_log/mc_audit_log__baseline__rep1/injected_context.md"
    }
  },
  {
    "trial_id": "mc_audit_log__mcp_only__rep3",
    "task_id": "mc_audit_log",
    "family": "memory_critical",
    "suite": "capability",
    "condition": "mcp_only",
    "replicate": 3,
    "model": "sonnet",
    "effort": "medium",
    "judge_model": null,
    "started_at": "2026-06-23T17:55:21.970625+00:00",
    "finished_at": "2026-06-23T17:56:27.879217+00:00",
    "duration_seconds": 65.90860295295715,
    "solved": false,
    "completeness": 0.8,
    "no_regression": true,
    "static_clean": true,
    "completed_within_limits": true,
    "scores": {
      "outcome_pass": false,
      "regression_pass": true,
      "static_pass": true,
      "completeness": 0.8,
      "rubric_score": 0.0
    },
    "manipulation_check": {
      "injected_context_chars": 0,
      "seeded_memory_count": 3,
      "recall_calls": 0,
      "memory_fired": false,
      "notes": [
        "recall is agent-initiated; see recall_calls metric"
      ]
    },
    "metrics": {
      "assistant_message_count": 25,
      "tool_use_count": 18,
      "mcp_calls": 0,
      "recall_calls": 0,
      "tool_error_count": 0,
      "completed": true,
      "result_subtype": "success",
      "num_turns": 8,
      "total_cost_usd": 0.17683965000000001,
      "duration_ms": 63518,
      "token_input": 10,
      "token_output": 1648,
      "token_cache_read": 152468,
      "token_cache_creation": 12306,
      "files_changed": 8,
      "diff_lines_added": 27,
      "diff_lines_deleted": 0,
      "claude_exit_code": 0,
      "injected_context_chars": 0,
      "seeded_memory_count": 3
    },
    "paths": {
      "workspace": "<repo>/evals/runs_p/mc_audit_log/mc_audit_log__mcp_only__rep3/workspace",
      "stdout": "<repo>/evals/runs_p/mc_audit_log/mc_audit_log__mcp_only__rep3/claude.stdout.log",
      "stream_json": "<repo>/evals/runs_p/mc_audit_log/mc_audit_log__mcp_only__rep3/claude.stream.jsonl",
      "git_diff": "<repo>/evals/runs_p/mc_audit_log/mc_audit_log__mcp_only__rep3/git.diff.patch",
      "grader_log": "<repo>/evals/runs_p/mc_audit_log/mc_audit_log__mcp_only__rep3/grader.log.json",
      "injected_context": "<repo>/evals/runs_p/mc_audit_log/mc_audit_log__mcp_only__rep3/injected_context.md"
    }
  },
  {
    "trial_id": "mc_audit_log__hooks_only__rep3",
    "task_id": "mc_audit_log",
    "family": "memory_critical",
    "suite": "capability",
    "condition": "hooks_only",
    "replicate": 3,
    "model": "sonnet",
    "effort": "medium",
    "judge_model": null,
    "started_at": "2026-06-23T17:51:12.327067+00:00",
    "finished_at": "2026-06-23T17:51:59.953076+00:00",
    "duration_seconds": 47.626014947891235,
    "solved": true,
    "completeness": 1.0,
    "no_regression": true,
    "static_clean": true,
    "completed_within_limits": true,
    "scores": {
      "outcome_pass": true,
      "regression_pass": true,
      "static_pass": true,
      "completeness": 1.0,
      "rubric_score": 0.0
    },
    "manipulation_check": {
      "injected_context_chars": 795,
      "seeded_memory_count": 3,
      "recall_calls": 0,
      "memory_fired": true,
      "notes": []
    },
    "metrics": {
      "assistant_message_count": 17,
      "tool_use_count": 9,
      "mcp_calls": 0,
      "recall_calls": 0,
      "tool_error_count": 0,
      "completed": true,
      "result_subtype": "success",
      "num_turns": 10,
      "total_cost_usd": 0.1940655,
      "duration_ms": 45259,
      "token_input": 10,
      "token_output": 2509,